src/ghes-releases/lib/enterprise-dates.json

{
  "11.10": {
    "releaseDate": "2014-06-09",
    "deprecationDate": "2015-07-07",
    "releaseCandidateDate": "2014-06-09",
    "generalAvailabilityDate": "2014-07-07"
  },
  "2.0": {
    "releaseDate": "2014-10-14",
    "deprecationDate": "2016-02-09",
    "releaseCandidateDate": "2014-10-14",
    "generalAvailabilityDate": "2014-11-11"
  },
  "2.1": {
    "releaseDate": "2014-12-23",
    "deprecationDate": "2016-04-26",
    "releaseCandidateDate": "2014-12-23",
    "generalAvailabilityDate": "2015-01-20"
  },
  "2.2": {
    "releaseDate": "2015-04-01",
    "deprecationDate": "2016-08-03",
    "releaseCandidateDate": "2015-04-01",
    "generalAvailabilityDate": "2015-04-29"
  },
  "2.3": {
    "releaseDate": "2015-07-06",
    "deprecationDate": "2016-11-01",
    "releaseCandidateDate": "2015-07-06",
    "generalAvailabilityDate": "2015-08-03"
  },
  "2.4": {
    "releaseDate": "2015-09-15",
    "deprecationDate": "2017-02-09",
    "releaseCandidateDate": "2015-09-15",
    "generalAvailabilityDate": "2015-10-13"
  },
  "2.5": {
    "releaseDate": "2016-01-12",
    "deprecationDate": "2017-03-14",
    "releaseCandidateDate": "2016-01-12",
    "generalAvailabilityDate": "2016-02-09"
  },
  "2.6": {
    "releaseDate": "2016-03-29",
    "deprecationDate": "2017-04-26",
    "releaseCandidateDate": "2016-03-29",
    "generalAvailabilityDate": "2016-04-26"
  },
  "2.7": {
    "releaseDate": "2016-07-06",
    "deprecationDate": "2017-08-03",
    "releaseCandidateDate": "2016-07-06",
    "generalAvailabilityDate": "2016-08-03"
  },
  "2.8": {
    "releaseDate": "2016-10-12",
    "deprecationDate": "2017-11-09",
    "releaseCandidateDate": "2016-10-12",
    "generalAvailabilityDate": "2016-11-09"
  },
  "2.9": {
    "releaseDate": "2017-02-01",
    "deprecationDate": "2018-03-01",
    "releaseCandidateDate": "2017-02-01",
    "generalAvailabilityDate": "2017-03-01"
  },
  "2.10": {
    "releaseDate": "2017-05-08",
    "deprecationDate": "2018-06-05",
    "releaseCandidateDate": "2017-05-08",
    "generalAvailabilityDate": "2017-06-05"
  },
  "2.11": {
    "releaseDate": "2017-08-16",
    "deprecationDate": "2018-09-13",
    "releaseCandidateDate": "2017-08-16",
    "generalAvailabilityDate": "2017-09-13"
  },
  "2.12": {
    "releaseDate": "2017-11-14",
    "deprecationDate": "2018-12-12",
    "releaseCandidateDate": "2017-11-14",
    "generalAvailabilityDate": "2017-12-12"
  },
  "2.13": {
    "releaseDate": "2018-02-27",
    "deprecationDate": "2019-03-27",
    "releaseCandidateDate": "2018-02-27",
    "generalAvailabilityDate": "2018-03-27"
  },
  "2.14": {
    "releaseDate": "2018-06-14",
    "deprecationDate": "2019-07-12",
    "releaseCandidateDate": "2018-06-14",
    "generalAvailabilityDate": "2018-07-12"
  },
  "2.15": {
    "releaseDate": "2018-09-18",
    "deprecationDate": "2019-10-16",
    "releaseCandidateDate": "2018-09-18",
    "generalAvailabilityDate": "2018-10-16"
  },
  "2.16": {
    "releaseDate": "2018-12-25",
    "deprecationDate": "2020-01-22",
    "releaseCandidateDate": "2018-12-25",
    "generalAvailabilityDate": "2019-01-22"
  },
  "2.17": {
    "releaseDate": "2019-04-25",
    "deprecationDate": "2020-05-23",
    "releaseCandidateDate": "2019-04-25",
    "generalAvailabilityDate": "2019-05-23"
  },
  "2.18": {
    "releaseDate": "2019-07-23",
    "deprecationDate": "2020-08-20",
    "releaseCandidateDate": "2019-07-23",
    "generalAvailabilityDate": "2019-08-20"
  },
  "2.19": {
    "releaseDate": "2019-10-15",
    "deprecationDate": "2020-11-12",
    "releaseCandidateDate": "2019-10-15",
    "generalAvailabilityDate": "2019-11-12"
  },
  "2.20": {
    "releaseDate": "2020-01-14",
    "deprecationDate": "2021-03-02",
    "releaseCandidateDate": "2020-01-14",
    "generalAvailabilityDate": "2020-02-11"
  },
  "2.21": {
    "releaseDate": "2020-05-12",
    "deprecationDate": "2021-06-09",
    "releaseCandidateDate": "2020-05-12",
    "generalAvailabilityDate": "2020-06-09"
  },
  "2.22": {
    "releaseDate": "2020-08-26",
    "deprecationDate": "2021-09-23",
    "releaseCandidateDate": "2020-08-26",
    "generalAvailabilityDate": "2020-09-23"
  },
  "3.0": {
    "releaseDate": "2021-01-12",
    "deprecationDate": "2022-02-16",
    "releaseCandidateDate": "2021-01-12",
    "generalAvailabilityDate": "2021-02-16"
  },
  "3.1": {
    "releaseDate": "2021-05-06",
    "deprecationDate": "2022-06-30",
    "releaseCandidateDate": "2021-05-06",
    "generalAvailabilityDate": "2021-06-03"
  },
  "3.2": {
    "releaseDate": "2021-09-09",
    "deprecationDate": "2022-10-12",
    "releaseCandidateDate": "2021-09-09",
    "generalAvailabilityDate": "2021-09-28"
  },
  "3.3": {
    "releaseDate": "2021-11-09",
    "deprecationDate": "2023-01-18",
    "releaseCandidateDate": "2021-11-09",
    "generalAvailabilityDate": "2021-12-07"
  },
  "3.4": {
    "releaseDate": "2022-02-15",
    "deprecationDate": "2023-03-23",
    "releaseCandidateDate": "2022-02-15",
    "generalAvailabilityDate": "2022-03-15"
  },
  "3.5": {
    "releaseDate": "2022-05-10",
    "deprecationDate": "2023-06-29",
    "releaseCandidateDate": "2022-05-10",
    "generalAvailabilityDate": "2022-05-31"
  },
  "3.6": {
    "releaseDate": "2022-07-26",
    "deprecationDate": "2023-09-25",
    "releaseCandidateDate": "2022-07-26",
    "generalAvailabilityDate": "2022-08-16"
  },
  "3.7": {
    "releaseDate": "2022-10-25",
    "deprecationDate": "2024-01-04",
    "releaseCandidateDate": "2022-10-25",
    "generalAvailabilityDate": "2022-11-08"
  },
  "3.8": {
    "releaseDate": "2023-02-07",
    "deprecationDate": "2024-03-26",
    "releaseCandidateDate": "2023-02-07",
    "generalAvailabilityDate": "2023-03-07"
  },
  "3.9": {
    "releaseDate": "2023-06-08",
    "deprecationDate": "2024-07-26",
    "releaseCandidateDate": "2023-06-08",
    "generalAvailabilityDate": "2023-06-29"
  },
  "3.10": {
    "releaseDate": "2023-08-08",
    "deprecationDate": "2024-09-25",
    "releaseCandidateDate": "2023-08-08",
    "generalAvailabilityDate": "2023-08-29"
  },
  "3.11": {
    "releaseDate": "2023-11-14",
    "deprecationDate": "2024-12-19",
    "releaseCandidateDate": "2023-11-14",
    "generalAvailabilityDate": "2023-12-05"
  },
  "3.12": {
    "releaseDate": "2024-02-13",
    "deprecationDate": "2025-04-03",
    "releaseCandidateDate": "2024-02-13",
    "generalAvailabilityDate": "2024-03-05"
  },
  "3.13": {
    "releaseDate": "2024-05-16",
    "deprecationDate": "2025-06-19",
    "releaseCandidateDate": "2024-05-16",
    "generalAvailabilityDate": "2024-06-18"
  },
  "3.14": {
    "releaseDate": "2024-08-06",
    "deprecationDate": "2026-04-23",
    "releaseCandidateDate": "2024-08-06",
    "generalAvailabilityDate": "2024-08-27"
  },
  "3.15": {
    "releaseDate": "2024-11-12",
    "deprecationDate": "2026-04-23",
    "releaseCandidateDate": "2024-11-12",
    "generalAvailabilityDate": "2024-12-03"
  },
  "3.16": {
    "releaseDate": "2025-02-25",
    "deprecationDate": "2026-07-01",
    "releaseCandidateDate": "2025-02-25",
    "generalAvailabilityDate": "2025-03-11"
  },
  "3.17": {
    "releaseDate": "2025-05-13",
    "deprecationDate": "2026-09-24",
    "releaseCandidateDate": "2025-05-13",
    "generalAvailabilityDate": "2025-06-03"
  },
  "3.18": {
    "releaseDate": "2025-09-03",
    "deprecationDate": "2026-10-14",
    "releaseCandidateDate": "2025-09-03",
    "generalAvailabilityDate": "2025-10-14"
  },
  "3.19": {
    "releaseDate": "2025-12-02",
    "deprecationDate": "2026-12-09",
    "releaseCandidateDate": "2025-12-02",
    "generalAvailabilityDate": "2025-12-09"
  },
  "3.20": {
    "releaseDate": "2026-02-24",
    "deprecationDate": "2027-03-17",
    "releaseCandidateDate": "2026-02-24",
    "generalAvailabilityDate": "2026-03-17"
  },
  "3.21": {
    "releaseDate": "2026-05-12",
    "deprecationDate": "2027-06-11",
    "releaseCandidateDate": "2026-05-12",
    "generalAvailabilityDate": "2026-06-11"
  },
  "3.22": {
    "releaseDate": "2026-08-11",
    "deprecationDate": "2027-09-08",
    "releaseCandidateDate": "2026-08-11",
    "generalAvailabilityDate": "2026-09-08"
  },
  "3.23": {
    "releaseDate": "2026-11-10",
    "deprecationDate": "2027-12-08",
    "releaseCandidateDate": "2026-11-10",
    "generalAvailabilityDate": "2026-12-08"
  },
  "3.24": {
    "releaseDate": "2027-02-23",
    "deprecationDate": "2028-03-16",
    "releaseCandidateDate": "2027-02-23",
    "generalAvailabilityDate": "2027-03-16"
  },
  "3.25": {
    "releaseDate": "2027-05-18",
    "deprecationDate": "2028-06-08",
    "releaseCandidateDate": "2027-05-18",
    "generalAvailabilityDate": "2027-06-08"
  },
  "3.26": {
    "releaseDate": "2027-08-10",
    "deprecationDate": "2028-08-31",
    "releaseCandidateDate": "2027-08-10",
    "generalAvailabilityDate": "2027-08-31"
  },
  "3.27": {
    "releaseDate": "2027-11-16",
    "deprecationDate": "2028-12-07",
    "releaseCandidateDate": "2027-11-16",
    "generalAvailabilityDate": "2027-12-07"
  }
}

content/admin/upgrading-your-instance/preparing-to-upgrade/upgrade-requirements.md

## Recommendations

* Include as few upgrades as possible in your upgrade process. For example, instead of upgrading from {% data variables.product.prodname_enterprise %} {{ enterpriseServerReleases.supported[2] }} to {{ enterpriseServerReleases.supported[1] }} to {{ enterpriseServerReleases.latest }}, you could upgrade from {% data variables.product.prodname_enterprise %} {{ enterpriseServerReleases.supported[2] }} to {{ enterpriseServerReleases.latest }}. Use the [{% data variables.enterprise.upgrade_assistant %}](https://support.github.com/enterprise/server-upgrade) to find the upgrade path from your current release version.
* If you’re several versions behind, upgrade {% data variables.location.product_location %} as far forward as possible with each step of your upgrade process. Using the latest version possible on each upgrade allows you to take advantage of performance improvements and bug fixes. For example, you could upgrade from {% data variables.product.prodname_enterprise %} 2.7 to 2.8 to 2.10, but upgrading from {% data variables.product.prodname_enterprise %} 2.7 to 2.9 to 2.10 uses a later version in the second step.
* Use the latest patch release when upgrading. {% data reusables.enterprise_installation.enterprise-download-upgrade-pkg %}
* Use a staging instance to test the upgrade steps. For more information, see "[AUTOTITLE](/admin/installation/setting-up-a-github-enterprise-server-instance/setting-up-a-staging-instance)."
* When running multiple upgrades, {% ifversion ghes-upgrade-complete-indicator %}ensure data migrations and upgrade tasks running in the background are fully complete before proceeding to the next feature upgrade. To check the status of these processes, you can use the `ghe-migrations` and `ghe-check-background-upgrade-jobs` command-line utilities. {% ifversion ghes < 3.12 %} To use `ghe-check-background-upgrade-jobs` with {% data variables.product.product_name %} {{ allVersions[currentVersion].currentRelease }}, your instance must run version {{ allVersions[currentVersion].currentRelease }}.{% ifversion ghes = 3.10 %}4{% elsif ghes = 3.11 %}1{% endif %} or later. {% endif %}For more information, see "[AUTOTITLE](/admin/configuration/configuring-your-enterprise/command-line-utilities#upgrading-github-enterprise-server)."{% else %}wait at least 24 hours between feature upgrades to allow data migrations and upgrade tasks running in the background to fully complete.{% endif %}
* Take a snapshot before upgrading your virtual machine. For more information, see "[AUTOTITLE](/admin/upgrading-your-instance/preparing-to-upgrade/taking-a-snapshot)."
* Ensure you have a recent, successful backup of your instance. For more information, see the [{% data variables.product.prodname_enterprise_backup_utilities %} README.md file](https://github.com/github/backup-utils#readme).

## Requirements

* You must upgrade from a feature release that's **at most** two releases behind. For example, to upgrade to {% data variables.product.prodname_enterprise %} {{ enterpriseServerReleases.latest }}, you must be on {% data variables.product.prodname_enterprise %} {{ enterpriseServerReleases.supported[1] }} or {{ enterpriseServerReleases.supported[2] }}.
* When upgrading using an upgrade package, schedule a maintenance window for {% data variables.product.prodname_ghe_server %} end users.
* {% data reusables.enterprise_installation.hotpatching-explanation %}
* A hotpatch may require downtime if the affected services (like kernel, MySQL, or Elasticsearch) require a VM reboot or a service restart. You'll be notified when a reboot or restart is required. You can complete the reboot or restart at a later time.
* Additional root storage must be available when upgrading through hotpatching, as it installs multiple versions of certain services until the upgrade is complete. Pre-flight checks will notify you if you don't have enough root disk storage.
* When upgrading through hotpatching, your instance cannot be too heavily loaded, as it may impact the hotpatching process.
* Upgrading to {% data variables.product.prodname_ghe_server %} 2.17 migrates your audit logs from Elasticsearch to MySQL. This migration also increases the amount of time and disk space it takes to restore a snapshot. Before migrating, check the number of bytes in your Elasticsearch audit log indices with this command: